{
  "schema_version": "1.0.0",
  "episode_id": "PD-2026-001-example",
  "platform_video_id": "EXAMPLE_VIDEO_ID",
  "window": "24h",
  "captured_at": "2026-06-13T12:00:00+09:00",
  "metrics": {
    "impressions": 10000,
    "ctr": 0.055,
    "views": 720,
    "watch_time_hours": 180,
    "average_view_duration_seconds": 900,
    "average_percentage_viewed": 0.625,
    "subscribers_gained": 25,
    "likes": 90,
    "comments": 12,
    "revenue": {
      "amount": 18.5,
      "currency": "USD"
    }
  },
  "retention_points": [
    {
      "second": 0,
      "relative_retention": 1.0
    },
    {
      "second": 30,
      "relative_retention": 0.76
    },
    {
      "second": 300,
      "relative_retention": 0.62
    }
  ],
  "notes": "Synthetic example only."
}
